{
  "generated_at": "2026-05-08T00:03:15.327864+00:00",
  "generator": "scintilla-inteligencia ETL",
  "catalog": {
    "total_indicators": 24,
    "domains": {
      "cobertura": 5,
      "qualidade": 3,
      "infraestrutura": 1,
      "mercado": 3,
      "dinamismo": 2
    }
  },
  "indicators": {
    "cob_distribuicao_dependencia": {
      "name": "Distribuição de matrículas EPT por dependência administrativa",
      "domain": "cobertura",
      "recortes": [
        "total_estado"
      ],
      "polaridade_inversa": false,
      "lag_months": 12,
      "source": [
        "br_inep_censo_escolar.turma"
      ],
      "pne_meta": null
    },
    "cob_municipios_com_ept": {
      "name": "% municípios com pelo menos 1 escola técnica",
      "domain": "cobertura",
      "recortes": [
        "total_estado",
        "rede_estadual"
      ],
      "polaridade_inversa": false,
      "lag_months": 12,
      "source": [
        "br_inep_censo_escolar.escola",
        "br_inep_censo_escolar.matricula"
      ],
      "pne_meta": null
    },
    "cob_eixos_cobertos": {
      "name": "Eixos tecnológicos cobertos (de 13)",
      "domain": "cobertura",
      "recortes": [
        "total_estado",
        "rede_estadual"
      ],
      "polaridade_inversa": false,
      "lag_months": 12,
      "source": [
        "br_inep_censo_escolar.turma"
      ],
      "pne_meta": null
    },
    "cob_distribuicao_modalidade": {
      "name": "Distribuição de matrículas EPT por modalidade",
      "domain": "cobertura",
      "recortes": [
        "total_estado",
        "rede_estadual"
      ],
      "polaridade_inversa": false,
      "lag_months": 12,
      "source": [
        "br_inep_censo_escolar.turma"
      ],
      "pne_meta": "integrada_concomitante_50pct_2036"
    },
    "qua_taxas_rendimento_ept": {
      "name": "Taxas de rendimento (aprovação/reprovação/abandono) na última série EPT",
      "domain": "qualidade",
      "recortes": [
        "total_estado",
        "rede_estadual"
      ],
      "polaridade_inversa": true,
      "lag_months": 12,
      "source": [
        "br_inep_indicadores_educacionais.escola",
        "br_inep_censo_escolar.matricula"
      ],
      "pne_meta": null
    },
    "qua_ideb_escolas_ept": {
      "name": "IDEB médio das escolas com oferta EPT",
      "domain": "qualidade",
      "recortes": [
        "total_estado",
        "rede_estadual"
      ],
      "polaridade_inversa": false,
      "lag_months": 24,
      "source": [
        "br_inep_ideb.escola",
        "br_inep_censo_escolar.escola"
      ],
      "pne_meta": null
    },
    "qua_razao_aluno_professor_ept": {
      "name": "Razão aluno/professor em EPT",
      "domain": "qualidade",
      "recortes": [
        "total_estado",
        "rede_estadual"
      ],
      "polaridade_inversa": true,
      "lag_months": 12,
      "source": [
        "br_inep_censo_escolar.matricula",
        "br_inep_censo_escolar.docente"
      ],
      "pne_meta": null
    },
    "inf_conectividade_ept": {
      "name": "Conectividade nas escolas com EPT (pirâmide de tiers)",
      "domain": "infraestrutura",
      "recortes": [
        "total_estado",
        "rede_estadual"
      ],
      "polaridade_inversa": false,
      "lag_months": 12,
      "source": [
        "br_inep_censo_escolar.escola",
        "br_inep_censo_escolar.matricula"
      ],
      "pne_meta": "conectividade_50pct_2y_100pct_10y"
    },
    "mer_saldo_caged_tecnicos": {
      "name": "Saldo CAGED em ocupações CBO 3xxxx (12m)",
      "domain": "mercado",
      "recortes": [
        "total_estado"
      ],
      "polaridade_inversa": false,
      "lag_months": 3,
      "source": [
        "br_me_caged.microdados_movimentacao"
      ],
      "pne_meta": null
    },
    "mer_premio_salarial_escolaridade": {
      "name": "Prêmio salarial por nível de escolaridade",
      "domain": "mercado",
      "recortes": [
        "total_estado"
      ],
      "polaridade_inversa": false,
      "lag_months": 12,
      "source": [
        "br_me_rais.microdados_vinculos"
      ],
      "pne_meta": null
    },
    "mer_neet_rate": {
      "name": "NEET rate — % jovens 15-29 que não estudam nem trabalham",
      "domain": "mercado",
      "recortes": [
        "total_estado"
      ],
      "polaridade_inversa": true,
      "lag_months": 6,
      "source": [
        "br_ibge_pnadc.microdados"
      ],
      "pne_meta": null
    },
    "din_crescimento_matriculas_5y": {
      "name": "Crescimento de matrículas EPT em 5 anos",
      "domain": "dinamismo",
      "recortes": [
        "total_estado",
        "rede_estadual"
      ],
      "polaridade_inversa": false,
      "lag_months": 12,
      "source": [
        "br_inep_censo_escolar.turma"
      ],
      "pne_meta": "subsequente_60pct"
    },
    "din_cursos_novos_ept": {
      "name": "Cursos novos abertos nos últimos 2 anos",
      "domain": "dinamismo",
      "recortes": [
        "total_estado",
        "rede_estadual"
      ],
      "polaridade_inversa": false,
      "lag_months": 12,
      "source": [
        "br_inep_censo_escolar.turma"
      ],
      "pne_meta": null
    },
    "pne_m12a": {
      "name": "Meta 12.a · % EM em integrada+concomitante",
      "domain": "pne",
      "recortes": [
        "total_estado",
        "rede_estadual"
      ],
      "polaridade_inversa": false,
      "lag_months": 12,
      "source": [
        "br_inep_censo_escolar.escola"
      ],
      "pne_meta": "m12a_50pct_2036"
    },
    "pne_m12b": {
      "name": "Meta 12.b · expansão +60% em cursos subsequentes",
      "domain": "pne",
      "recortes": [
        "total_estado",
        "rede_estadual"
      ],
      "polaridade_inversa": false,
      "lag_months": 12,
      "source": [
        "br_inep_censo_escolar.escola"
      ],
      "pne_meta": "m12b_60pct_2036"
    },
    "pne_m12c": {
      "name": "Meta 12.c · % EJA articulada à profissional",
      "domain": "pne",
      "recortes": [
        "total_estado"
      ],
      "polaridade_inversa": false,
      "lag_months": 12,
      "source": [
        "br_inep_censo_escolar.escola"
      ],
      "pne_meta": "m12c_25pct_2031_50pct_2036"
    },
    "cob_perfil_alunos": {
      "name": "Perfil dos matriculados EPT — faixa etária, sexo, modalidade",
      "domain": "cobertura",
      "recortes": [
        "total_estado"
      ],
      "polaridade_inversa": false,
      "lag_months": 12,
      "source": [
        "br_inep_censo_escolar.matricula",
        "br_inep_censo_escolar.escola"
      ],
      "pne_meta": null
    },
    "cob_alcance_ponderado": {
      "name": "% matrículas EM em município com EPT + top 5 munis sem oferta",
      "domain": "cobertura",
      "recortes": [
        "total_estado"
      ],
      "polaridade_inversa": false,
      "lag_months": 12,
      "source": [
        "br_inep_censo_escolar.escola",
        "br_bd_diretorios_brasil.municipio"
      ],
      "pne_meta": null
    },
    "qua_saeb_proficiencia_ept": {
      "name": "Proficiência SAEB Mat/Port — escolas com EPT vs sem EPT",
      "domain": "qualidade",
      "recortes": [
        "total_estado"
      ],
      "polaridade_inversa": false,
      "lag_months": 24,
      "source": [
        "br_inep_saeb.proficiencia",
        "br_inep_censo_escolar.escola"
      ],
      "pne_meta": null
    },
    "qua_abandono_em_ept": {
      "name": "Taxa de abandono EM — escolas com EPT vs sem EPT",
      "domain": "qualidade",
      "recortes": [
        "total_estado"
      ],
      "polaridade_inversa": true,
      "lag_months": 12,
      "source": [
        "br_inep_indicadores_educacionais.escola",
        "br_inep_censo_escolar.escola"
      ],
      "pne_meta": null
    },
    "mer_demanda_cbo_top": {
      "name": "Top 10 ocupações técnicas por saldo CAGED (12m)",
      "domain": "mercado",
      "recortes": [
        "total_estado"
      ],
      "polaridade_inversa": false,
      "lag_months": 3,
      "source": [
        "br_me_caged.microdados_movimentacao",
        "br_bd_diretorios_brasil.cbo_2002"
      ],
      "pne_meta": null
    },
    "mer_demanda_mesorregiao": {
      "name": "Saldo CBO 3xxxx por mesorregião IBGE (12m)",
      "domain": "mercado",
      "recortes": [
        "total_estado"
      ],
      "polaridade_inversa": false,
      "lag_months": 3,
      "source": [
        "br_me_caged.microdados_movimentacao",
        "br_bd_diretorios_brasil.municipio"
      ],
      "pne_meta": null
    },
    "mer_coorte_sintetica_pnad": {
      "name": "Coorte sintética 18-19 → 19-20 — 4 caminhos pós-EM (PNAD)",
      "domain": "mercado",
      "recortes": [
        "total_estado"
      ],
      "polaridade_inversa": false,
      "lag_months": 6,
      "source": [
        "br_ibge_pnadc.microdados"
      ],
      "pne_meta": null
    },
    "mer_aderencia_eixo_cbo": {
      "name": "Aderência oferta EPT × demanda CBO por eixo CNCT",
      "domain": "mercado",
      "recortes": [
        "total_estado"
      ],
      "polaridade_inversa": false,
      "lag_months": 3,
      "source": [
        "br_inep_censo_escolar.matricula",
        "br_me_caged.microdados_movimentacao"
      ],
      "pne_meta": null
    }
  }
}